{
  "$schema": "https://hyperframes.heygen.com/schema/registry-item.json",
  "name": "vfx-cinematic-camera",
  "type": "hyperframes:block",
  "title": "Cinematic Camera",
  "description": "Three.js cinematic camera controller — dolly zoom, crane shot, orbit, and rack focus applied to HTML content mapped onto a 3D plane",
  "stability": "experimental",
  "dimensions": {
    "width": 1920,
    "height": 1080
  },
  "duration": 16,
  "tags": ["html-in-canvas", "three-js", "camera", "cinematic"],
  "files": [
    {
      "path": "vfx-cinematic-camera.html",
      "target": "compositions/vfx-cinematic-camera.html",
      "type": "hyperframes:composition"
    }
  ]
}
